{
  "$schema": "https://json-schema.org/draft/2020-12/schema",
  "$id": "https://cyber-security.invalid/contracts/decision-policy.schema.json",
  "title": "host-guard v5 decision-policy",
  "$comment": "设计候选；业务、时间、归属和签名不变量见检测与处置契约。",
  "type": "object",
  "additionalProperties": false,
  "properties": {
    "contractVersion": {
      "const": "host-guard/5.0.0-rc.4"
    },
    "policyId": {
      "type": "string",
      "format": "uuid"
    },
    "policyVersion": {
      "type": "string",
      "minLength": 1,
      "maxLength": 160
    },
    "mode": {
      "type": "string",
      "enum": [
        "alert_only",
        "auto"
      ]
    },
    "modelId": {
      "type": "string",
      "format": "uuid"
    },
    "family": {
      "type": "string",
      "minLength": 1,
      "maxLength": 160
    },
    "familyPolicies": {
      "type": "array",
      "items": {
        "type": "object",
        "additionalProperties": false,
        "properties": {
          "family": {"type": "string", "enum": ["port_scan", "brute_force", "dos_flood", "dos_slow"]},
          "autoEligible": {"type": "boolean"},
          "modelAutoEligible": {"type": "boolean", "$comment": "模型来源是否可进入自动路径；须 autoEligible=true 才可为 true。规则来源由 rulePolicies[].autoEligible 单独控制"},
          "alertThreshold": {"type": "number", "minimum": 0, "maximum": 1},
          "autoThreshold": {"type": "number", "minimum": 0, "maximum": 1},
          "minDistinctFlows": {"type": "integer", "minimum": 1, "maximum": 1000},
          "scope": {"type": "string", "enum": ["peer_service", "peer_inbound"]}
        },
        "required": ["family", "autoEligible", "modelAutoEligible", "alertThreshold", "autoThreshold", "minDistinctFlows", "scope"]
      },
      "minItems": 4,
      "maxItems": 4
    },
    "rulePolicies": {
      "type": "array",
      "items": {
        "type": "object",
        "additionalProperties": false,
        "properties": {
          "ruleId": {"type": "string", "minLength": 1, "maxLength": 160},
          "family": {"type": "string", "enum": ["port_scan", "brute_force", "dos_flood", "dos_slow"]},
          "field": {"type": "string", "minLength": 1, "maxLength": 160},
          "operator": {"type": "string", "enum": ["gte", "gt", "lte", "lt", "eq"]},
          "threshold": {"type": "number", "minimum": 0},
          "autoEligible": {"type": "boolean"}
        },
        "required": ["ruleId", "family", "field", "operator", "threshold", "autoEligible"]
      },
      "maxItems": 100
    },
    "profile": {
      "type": "string",
      "enum": [
        "flow-prefix-v1",
        "flow-final-v1"
      ]
    },
    "acceptedProfiles": {
      "type": "array",
      "description": "可选：自动路径接受的快照 profile 集合，须包含 profile；缺失时只接受 profile",
      "items": {
        "type": "string",
        "enum": [
          "flow-prefix-v1",
          "flow-final-v1"
        ]
      },
      "minItems": 1,
      "uniqueItems": true
    },
    "alertThreshold": {
      "type": "number",
      "minimum": 0,
      "maximum": 1
    },
    "autoThreshold": {
      "type": "number",
      "minimum": 0,
      "maximum": 1
    },
    "minDistinctFlows": {
      "type": "integer",
      "minimum": 1,
      "maximum": 1000
    },
    "minEvidenceSpanMs": {
      "type": "integer",
      "minimum": 0,
      "maximum": 30000
    },
    "episodeSeconds": {
      "const": 30
    },
    "contextWindowSeconds": {
      "enum": [
        1,
        5,
        30
      ]
    },
    "minPeerFlowStarts": {
      "type": "integer",
      "minimum": 0
    },
    "maxEvidenceAgeMs": {
      "type": "integer",
      "minimum": 1,
      "maximum": 10000
    },
    "maxTtlSeconds": {
      "type": "integer",
      "minimum": 5,
      "maximum": 60
    },
    "maxContinuousBlockSeconds": {
      "type": "integer",
      "minimum": 5,
      "maximum": 120
    },
    "maxActiveRulesPerAsset": {
      "type": "integer",
      "minimum": 1,
      "maximum": 10
    },
    "maxNewActionsPerMinute": {
      "type": "integer",
      "minimum": 1,
      "maximum": 5
    },
    "supportedCapabilityIds": {
      "type": "array",
      "items": {
        "type": "string",
        "format": "uuid"
      },
      "minItems": 1,
      "maxItems": 100,
      "uniqueItems": true
    },
    "protectionSetSha256": {
      "type": "string",
      "pattern": "^[0-9a-f]{64}$"
    },
    "evaluationPlanSha256": {
      "type": "string",
      "pattern": "^[0-9a-f]{64}$"
    }
  },
  "required": [
    "contractVersion",
    "policyId",
    "policyVersion",
    "mode",
    "modelId",
    "family",
    "profile",
    "alertThreshold",
    "autoThreshold",
    "minDistinctFlows",
    "minEvidenceSpanMs",
    "episodeSeconds",
    "contextWindowSeconds",
    "minPeerFlowStarts",
    "maxEvidenceAgeMs",
    "maxTtlSeconds",
    "maxContinuousBlockSeconds",
    "maxActiveRulesPerAsset",
    "maxNewActionsPerMinute",
    "supportedCapabilityIds",
    "protectionSetSha256",
    "evaluationPlanSha256",
    "familyPolicies"
  ]
}
